{"schema_version":1,"gate_id":"x4_r6_dhcp_dns_service_security_closeout_v1","status":"ACCEPTED_SOURCE_CLOSEOUT","track":{"parent_gate":"x4_r5_firewall_service_block_runtime_gate_v1","current_release":"X4_R6_DHCP_DNS_SERVICE_SECURITY_CLOSEOUT","next_release":"P9_R1_THESIS_WRITING_AND_DEFENSE","phase9_status":"P9_R1_PAUSED_BY_USER"},"source_boundary":{"parent_commit":"4df8d3ed62fcff0c860d46a7109f3ae09314acac","extension_policy":"APPEND_ONLY","runtime_inherited":false},"source_bindings":[{"path":"plans/expansion/X4_R0_DHCP_DNS_SERVICE_SECURITY_RUNTIME_GATE_V1.json","sha256":"2fefb30c48f63dd7763aba0ecdb53ebd4a4f8144c8ca2efae4c4100cea3530b4"},{"path":"plans/expansion/X4_R1_DHCP_SERVER_UNAVAILABLE_V1.json","sha256":"8c590010dda6a1afc2db8249931dc085eb5d556ffe5a4475db8f27bbebbac429"},{"path":"plans/expansion/X4_R2_DHCP_POOL_MISCONFIGURATION_V1.json","sha256":"22228e7665a4854b67bd5454b11d7eee095ad58c5d7071eb8ae39cdfb57adc67"},{"path":"plans/expansion/X4_R3_DNS_SERVICE_DOWN_V1.json","sha256":"821d9cd74b24b17d1c09afd0c7867b3ccdf8667e485658977f8e385e1bdd6338"},{"path":"plans/expansion/X4_R4_WRONG_DNS_RECORD_V1.json","sha256":"ef42a35795208db71262700220d47f312a18903150d5a76408b2ef80765512a0"},{"path":"plans/expansion/X4_R5_FIREWALL_SERVICE_BLOCK_V1.json","sha256":"1eb2ca10906b553f4a90fa8f3a92c6d4969356e1b30edb1e67e384663874d168"},{"path":"src/expansion/x4_gate.py","sha256":"53ebe2ee52b2f763ef92f0ed0d191e8b5fe4106f2a105e6553d9d905cb24bdc0"},{"path":"src/expansion/x4_r1_gate.py","sha256":"cce3df73bc830fae308004c5a272b733755cd6a46b7f035e9ac7005b87c7449a"},{"path":"src/expansion/x4_r2_gate.py","sha256":"2f224fe66f57e158405fd61ef0dc12ee4c99aafa409e1da2b3638547ee4aec82"},{"path":"src/expansion/x4_r3_gate.py","sha256":"1b1ca615b4e995da1e8192cb52fb9287b80d302fa1421c78eab2086a66b4b3f3"},{"path":"src/expansion/x4_r4_gate.py","sha256":"91db0a53aa225481ed0a821c968f4c1dd49cf6bfdfeecc15ed76994cb305bd0b"},{"path":"src/expansion/x4_r5_gate.py","sha256":"f48227a5663d46275f4cfa027b5ad1894b11dffe1b080b471de39ad99bb151fd"},{"path":"src/rules/service_security_rule_engine_x4_r1.py","sha256":"15e695485eec41abda9ca436c66d459016fcabd805a29d3f3b6d010658aa76e9"},{"path":"src/rules/service_security_rule_engine_x4_r2.py","sha256":"0f2efe1a8345438a68775692b463bbeb272c3ef81554fdbb18233d8e3f1bee3b"},{"path":"src/rules/service_security_rule_engine_x4_r3.py","sha256":"6d928a85caafb001f4d5f2e14083565b44976e4a9b81740f7d090a2d456d9393"},{"path":"src/rules/service_security_rule_engine_x4_r4.py","sha256":"1c22b738d72fdae242377904499f302533994c1cb72282020772bf042e3ecf20"},{"path":"src/rules/service_security_rule_engine_x4_r5.py","sha256":"ff106d6406df5d4292a77364fe1ff6c813d50c45b25941de5d441a729261c1d0"},{"path":"labs/topologies/x4_r1_dhcp_dns_service/topology_context_v1.json","sha256":"cbfd18eb4b4e43eac44ee0a4b4c4b56671f70f14e8aeae4f4d7c01f71647bd68"},{"path":"labs/topologies/x4_r1_dhcp_server_unavailable/topology_context_dhcp_flow_v1.json","sha256":"984c41ec3f33d11bb2974083a3c261e514d765a1af2db4adc22adf703380a013"},{"path":"labs/topologies/x4_r3_dns_service_unavailable/topology_context_dns_flow_v1.json","sha256":"b55b9bfd6dcc8bc8daf181e8f4b4b8592e822c7a8e496cff0b0e66c2327d562c"},{"path":"labs/images/ind-x4-dhcp/Dockerfile","sha256":"8cdd96e69aa1c084df90ec29b4496a6cc99afb85b96bc45b34052c9b6450c111"},{"path":"labs/images/ind-x4-dhcp/IMAGE_PROVENANCE_V1.json","sha256":"ccb0b81e9d2aaa04dd4c4f507fa3c858f097443afd879b27ff5d00dacf4b4feb"},{"path":"schemas/evidence_v4.schema.json","sha256":"dcc61966246a03a03d060714a67b5cf14aa48f6925c262c267d07408b77f8315"},{"path":"schemas/diagnosis_result_v2.schema.json","sha256":"40699655b2eece5d80e009993398d1ee5eb028ec88b6edf18e6849659ccc3556"}],"accepted_slices":[{"release_id":"X4_R1_DHCP_SERVER_UNAVAILABLE","fault_type":"dhcp_server_unavailable","rule_id":"R_X4_SERVICE_SECURITY_001","topology_context_id":"x4_top_01_dhcp_dns_service_security_dhcp_flow_context_v1","expected_signature":{"dhcp_server_reachable":false,"dhcp_lease_obtained":false,"dhcp_lease_matches_expected_scope":false,"dns_server_reachable":true,"dns_query_succeeds":true,"dns_answer_matches_expected":true,"service_process_running":true,"service_port_reachable":true,"service_flow_blocked_by_policy":false}},{"release_id":"X4_R2_DHCP_POOL_MISCONFIGURATION","fault_type":"dhcp_pool_misconfiguration","rule_id":"R_X4_SERVICE_SECURITY_002","topology_context_id":"x4_top_01_dhcp_dns_service_security_dhcp_flow_context_v1","expected_signature":{"dhcp_server_reachable":true,"dhcp_lease_obtained":false,"dhcp_lease_matches_expected_scope":false,"dns_server_reachable":true,"dns_query_succeeds":true,"dns_answer_matches_expected":true,"service_process_running":true,"service_port_reachable":true,"service_flow_blocked_by_policy":false}},{"release_id":"X4_R3_DNS_SERVICE_DOWN","fault_type":"dns_service_down","rule_id":"R_X4_SERVICE_SECURITY_003","topology_context_id":"x4_top_01_dhcp_dns_service_security_dns_flow_context_v1","expected_signature":{"dhcp_server_reachable":true,"dhcp_lease_obtained":true,"dhcp_lease_matches_expected_scope":true,"dns_server_reachable":true,"dns_query_succeeds":false,"dns_answer_matches_expected":false,"service_process_running":false,"service_port_reachable":false,"service_flow_blocked_by_policy":false}},{"release_id":"X4_R4_WRONG_DNS_RECORD","fault_type":"wrong_dns_record","rule_id":"R_X4_SERVICE_SECURITY_004","topology_context_id":"x4_top_01_dhcp_dns_service_security_dns_flow_context_v1","expected_signature":{"dhcp_server_reachable":true,"dhcp_lease_obtained":true,"dhcp_lease_matches_expected_scope":true,"dns_server_reachable":true,"dns_query_succeeds":true,"dns_answer_matches_expected":false,"service_process_running":true,"service_port_reachable":true,"service_flow_blocked_by_policy":false}},{"release_id":"X4_R5_FIREWALL_SERVICE_BLOCK","fault_type":"firewall_service_block","rule_id":"R_X4_SERVICE_SECURITY_005","topology_context_id":"x4_top_01_dhcp_dns_service_security_context_v1","expected_signature":{"dhcp_server_reachable":true,"dhcp_lease_obtained":true,"dhcp_lease_matches_expected_scope":true,"dns_server_reachable":true,"dns_query_succeeds":true,"dns_answer_matches_expected":true,"service_process_running":true,"service_port_reachable":false,"service_flow_blocked_by_policy":true}}],"d3_release_alias":{"canonical_release":"X4_R3_DNS_SERVICE_DOWN","compatibility_alias":"X4_R3_DNS_SERVICE_UNAVAILABLE","mapping":"ONE_TO_ONE_SAME_SLICE"},"evidence_receipt":{"path":"plans/expansion/X4_R6_DHCP_DNS_SERVICE_SECURITY_EVIDENCE_RECEIPT_V1.json","required":true,"run_count":5,"kind":"REPRODUCIBILITY_REVALIDATION_NOT_ORIGINAL_ACCEPTANCE_ARCHIVE","raw_artifact_hashes_required":true,"restoration_required":true,"baseline_before_after_required":true},"image_boundary":{"image":"ind-x4-dhcp:0.2","accepted_image_modified":false},"compatibility":{"frozen_phase6_9":"UNCHANGED","accepted_x2_x3":"UNCHANGED","api_v1":"UNCHANGED","d3_alias":"PRESERVED_ONE_TO_ONE"},"claim_boundary":{"proves":["five controlled single-fault variants on the accepted X4 service topology","reproducibility revalidation of exact Rule-Based signatures with Evidence v4","confirmed restoration and baseline recovery for the five revalidation runs"],"does_not_prove":["recovery of the original acceptance archives","arbitrary DHCP DNS service or firewall faults","unseen topology or generalization","datasets","ML or Hybrid performance","metrics","multiple-fault diagnosis","production deployment"]},"runtime_authorization":{"containerlab_execution":false,"network_mutation":false,"new_evidence_collection":false,"dataset_generation":false,"model_fit_or_selection":false,"estimator_deserialization":false,"method_prediction":false,"metric_calculation":false,"report_only_test_access":false,"multiple_fault_execution":false}}
